{
  "domain": "medicine-trace",
  "version": 1,
  "facts": [
    "药品实行一药一码并在流通环节持续采集信息",
    "异常药品可能跨省二次销售并经网络渠道流转",
    "包装损毁或码面涂改不能替代全国平台中的历史记录"
  ],
  "entities": [
    "药品追溯事件",
    "医保结算记录",
    "流通凭证",
    "扣押批次",
    "核查线索"
  ],
  "rules": [
    "历史事件不得被更正覆盖",
    "风险提示与违法认定必须分离",
    "公众查询不得暴露案件和参保人敏感信息"
  ],
  "sample": {
    "record_id": "demo-001",
    "status": "已登记",
    "source": "公开示例"
  }
}
